{
  "id": "braf-v600e",
  "protein": {
    "name": "Serine/threonine-protein kinase B-raf",
    "gene": "BRAF",
    "organism": "Homo sapiens",
    "uniprotAccession": "P15056",
    "uniprotUrl": "https://www.uniprot.org/uniprotkb/P15056",
    "fullLength": 766,
    "referenceSequence": "MAALSGGGGGGAEPGQALFNGDMEPEAGAGAGAAASSAADPAIPEEVWNIKQMIKLTQEHIEALLDKFGGEHNPPSIYLEAYEEYTSKLDALQQREQQLLESLGNGTDFSVSSSASMDTVTSSSSSSLSVLPSSLSVFQNPTDVARSNPKSPQKPIVRVFLPNKQRTVVPARCGVTVRDSLKKALMMRGLIPECCAVYRIQDGEKKPIGWDTDISWLTGEELHVEVLENVPLTTHNFVRKTFFTLAFCDFCRKLLFQGFRCQTCGYKFHQRCSTEVPLMCVNYDQLDLLFVSKFFEHHPIPQEEASLAETALTSGSSPSAPASDSIGPQILTSPSPSKSIPIPQPFRPADEDHRNQFGQRDRSSSAPNVHINTIEPVNIDDLIRDQGFRGDGGSTTGLSATPPASLPGSLTNVKALQKSPGPQRERKSSSSSEDRNRMKTLGRRDSSDDWEIPDGQITVGQRIGSGSFGTVYKGKWHGDVAVKMLNVTAPTPQQLQAFKNEVGVLRKTRHVNILLFMGYSTKPQLAIVTQWCEGSSLYHHLHIIETKFEMIKLIDIARQTAQGMDYLHAKSIIHRDLKSNNIFLHEDLTVKIGDFGLATVKSRWSGSHQFEQLSGSILWMAPEVIRMQDKNPYSFQSDVYAFGIVLYELMTGQLPYSNINNRDQIIFMVGRGYLSPDLSKVRSNCPKAMKRLMAECLKKKRDERPLFPQILASIELLARSLPKIHRSASEPSLNRAGFQTEDFSLYACASPKTPIQAGGYGAFPVH"
  },
  "variant": {
    "label": "V600E",
    "position": 600,
    "ref": "V",
    "alt": "E",
    "variantSequence": "MAALSGGGGGGAEPGQALFNGDMEPEAGAGAGAAASSAADPAIPEEVWNIKQMIKLTQEHIEALLDKFGGEHNPPSIYLEAYEEYTSKLDALQQREQQLLESLGNGTDFSVSSSASMDTVTSSSSSSLSVLPSSLSVFQNPTDVARSNPKSPQKPIVRVFLPNKQRTVVPARCGVTVRDSLKKALMMRGLIPECCAVYRIQDGEKKPIGWDTDISWLTGEELHVEVLENVPLTTHNFVRKTFFTLAFCDFCRKLLFQGFRCQTCGYKFHQRCSTEVPLMCVNYDQLDLLFVSKFFEHHPIPQEEASLAETALTSGSSPSAPASDSIGPQILTSPSPSKSIPIPQPFRPADEDHRNQFGQRDRSSSAPNVHINTIEPVNIDDLIRDQGFRGDGGSTTGLSATPPASLPGSLTNVKALQKSPGPQRERKSSSSSEDRNRMKTLGRRDSSDDWEIPDGQITVGQRIGSGSFGTVYKGKWHGDVAVKMLNVTAPTPQQLQAFKNEVGVLRKTRHVNILLFMGYSTKPQLAIVTQWCEGSSLYHHLHIIETKFEMIKLIDIARQTAQGMDYLHAKSIIHRDLKSNNIFLHEDLTVKIGDFGLATEKSRWSGSHQFEQLSGSILWMAPEVIRMQDKNPYSFQSDVYAFGIVLYELMTGQLPYSNINNRDQIIFMVGRGYLSPDLSKVRSNCPKAMKRLMAECLKKKRDERPLFPQILASIELLARSLPKIHRSASEPSLNRAGFQTEDFSLYACASPKTPIQAGGYGAFPVH",
    "sourceUrl": "https://www.uniprot.org/uniprotkb/P15056"
  },
  "structure": {
    "pdbId": "4XV2",
    "chain": "A",
    "residueMap": {
      "600": 600
    },
    "mappingVerified": true
  },
  "analysis": {
    "method": "positional",
    "referenceLength": 766,
    "variantLength": 766,
    "identical": false,
    "substitutions": [
      {
        "position": 600,
        "refAa": "V",
        "varAa": "E",
        "label": "V600E",
        "properties": {
          "classChanged": true,
          "fromClass": "nonpolar",
          "toClass": "negative",
          "chargeChange": -1,
          "hydropathyChange": -7.7,
          "source": "calculated",
          "note": "Calculated from standard reference tables (Kyte-Doolittle hydropathy, approximate charge at pH 7). Not evidence of functional effect."
        }
      }
    ],
    "insertions": [],
    "deletions": [],
    "summary": {
      "substitutionCount": 1,
      "insertionCount": 0,
      "deletionCount": 0,
      "identityPercent": 99.87
    },
    "source": "calculated"
  }
}
